drop database if exists h_tasks;
create database h_tasks;
use h_tasks;

drop table if exixts brands;
create table if not exists brands(
     id int unsigned primary key auto_increment,
     name varchar(100)
     );

create table if not exists categories(
     id int unsigned primary key auto_increment,
     name varchar(100)
     );

create table if not exists products(
     id int unsigned primary key auto_increment,
     product_name varchar(100),
     brand_id int(10),
     category_id int,
     price float,
     is_inactive tinyint default 0
     );
insert into brands(name)
values("Samsung");
insert into brands(name)
values("LG");
insert into brands(name)
values("Apple");

insert into categories(name)
values("Smart Phones");
insert into categories(name)
values("Laptops");
insert into categories(name)
values("Smart Watches");

insert into products(product_name,brand_id,category_id,price,is_active)
values("iPhone 17");
insert into products(name)
values("");




























Microsoft Windows [Version 10.0.26200.8457]
(c) Microsoft Corporation. All rights reserved.

G:\Arif-WDPF-70\xampp\mysql\bin> mysql -u root
Welcome to the MariaDB monitor.  Commands end with ; or \g.
Your MariaDB connection id is 9
Server version: 10.4.32-MariaDB mariadb.org binary distribution

Copyright (c) 2000, 2018, Oracle, MariaDB Corporation Ab and others.

Type 'help;' or '\h' for help. Type '\c' to clear the current input statement.

MariaDB [(none)]> create database home_tasks;
Query OK, 1 row affected (0.001 sec)

MariaDB [(none)]> use home_tasks;
Database changed
MariaDB [home_tasks]> show tables;
Empty set (0.001 sec)

MariaDB [home_tasks]> create table brands;
ERROR 1113 (42000): A table must have at least 1 column
MariaDB [home_tasks]> create table if not exists brands(
    ->      id int unsigned primary key auto_increment,
    ->      name varchar(100)
    ->      );
Query OK, 0 rows affected (0.137 sec)

MariaDB [home_tasks]> create table if not exists categories(
    ->      id int unsigned primary key auto_increment,
    ->      name varchar(100)
    ->      );
Query OK, 0 rows affected (0.148 sec)

MariaDB [home_tasks]> create table if not exists products(
    ->      id int unsigned primary key auto_increment,
    ->      product_name varchar(100),
    ->      brand_id int(10),
    ->      category_id int,
    ->      price float,
    ->      is_inactive tinyint default 0
    ->      );
Query OK, 0 rows affected (0.513 sec)

MariaDB [home_tasks]> show tables;
+----------------------+
| Tables_in_home_tasks |
+----------------------+
| brands               |
| categories           |
| products             |
+----------------------+
3 rows in set (0.001 sec)

MariaDB [home_tasks]> insert into brands(name)
    -> values(Samsung);
ERROR 1054 (42S22): Unknown column 'Samsung' in 'field list'
MariaDB [home_tasks]> insert into brands(name)
    -> values(LG);
ERROR 1054 (42S22): Unknown column 'LG' in 'field list'
MariaDB [home_tasks]> insert into brands(name)
    ->
    -> insert into brands(name)
    -> values("Samsung");
ERROR 1064 (42000): You have an error in your SQL syntax; check the manual that corresponds to your MariaDB server version for the right syntax to use near 'insert into brands(name)
values("Samsung")' at line 3
MariaDB [home_tasks]> insert into brands(name)
    -> values("LG");
Query OK, 1 row affected (0.038 sec)

MariaDB [home_tasks]> insert into brands(name)
    -> values("Apple");
Query OK, 1 row affected (0.027 sec)

MariaDB [home_tasks]> desc brands
    -> ;
+-------+------------------+------+-----+---------+----------------+
| Field | Type             | Null | Key | Default | Extra          |
+-------+------------------+------+-----+---------+----------------+
| id    | int(10) unsigned | NO   | PRI | NULL    | auto_increment |
| name  | varchar(100)     | YES  |     | NULL    |                |
+-------+------------------+------+-----+---------+----------------+
2 rows in set (0.034 sec)

MariaDB [home_tasks]> select * from brands;
+----+-------+
| id | name  |
+----+-------+
|  1 | LG    |
|  2 | Apple |
+----+-------+
2 rows in set (0.000 sec)

MariaDB [home_tasks]> insert into brands(name)
    -> values("Samsung");
Query OK, 1 row affected (0.039 sec)

MariaDB [home_tasks]> select * from brands;
+----+---------+
| id | name    |
+----+---------+
|  1 | LG      |
|  2 | Apple   |
|  3 | Samsung |
+----+---------+
3 rows in set (0.000 sec)

MariaDB [home_tasks]> insert into categories(name)
    -> values("Smart Phones");
Query OK, 1 row affected (0.031 sec)

MariaDB [home_tasks]> insert into categories(name)
    -> values("Laptops");
Query OK, 1 row affected (0.043 sec)

MariaDB [home_tasks]> insert into categories(name)
    -> values("Smart Watches");
Query OK, 1 row affected (0.041 sec)

MariaDB [home_tasks]> select * from categories;
+----+---------------+
| id | name          |
+----+---------------+
|  1 | Smart Phones  |
|  2 | Laptops       |
|  3 | Smart Watches |
+----+---------------+
3 rows in set (0.000 sec)

MariaDB [home_tasks]>



















































class  79

Microsoft Windows [Version 10.0.26200.8457]
(c) Microsoft Corporation. All rights reserved.

G:\Arif-WDPF-70\xampp\mysql\bin>mysql -u root
Welcome to the MariaDB monitor.  Commands end with ; or \g.
Your MariaDB connection id is 9
Server version: 10.4.32-MariaDB mariadb.org binary distribution

Copyright (c) 2000, 2018, Oracle, MariaDB Corporation Ab and others.

Type 'help;' or '\h' for help. Type '\c' to clear the current input statement.

MariaDB [(none)]> drop database if exists h_tasks;
Query OK, 0 rows affected, 1 warning (0.001 sec)

MariaDB [(none)]> create database h_tasks;
Query OK, 1 row affected (0.024 sec)

MariaDB [(none)]> use h_tasks;
Database changed
MariaDB [h_tasks]>
MariaDB [h_tasks]> drop table if exixts brands;
ERROR 1064 (42000): You have an error in your SQL syntax; check the manual that corresponds to your MariaDB server version for the right syntax to use near 'exixts brands' at line 1
MariaDB [h_tasks]> create table if not exists brands(
    ->      id int unsigned primary key auto_increment,
    ->      name varchar(100)
    ->      );
Query OK, 0 rows affected (0.177 sec)

MariaDB [h_tasks]>
MariaDB [h_tasks]> drop table if exixts categories;
ERROR 1064 (42000): You have an error in your SQL syntax; check the manual that corresponds to your MariaDB server version for the right syntax to use near 'exixts categories' at line 1
MariaDB [h_tasks]> create table if not exists categories(
    ->      id int unsigned primary key auto_increment,
    ->      name varchar(100)
    ->      );
Query OK, 0 rows affected (0.106 sec)

MariaDB [h_tasks]> show tables;
+-------------------+
| Tables_in_h_tasks |
+-------------------+
| brands            |
| categories        |
+-------------------+
2 rows in set (0.001 sec)

MariaDB [h_tasks]>
MariaDB [h_tasks]> drop table if exixts products;
ERROR 1064 (42000): You have an error in your SQL syntax; check the manual that corresponds to your MariaDB server version for the right syntax to use near 'exixts products' at line 1
MariaDB [h_tasks]> create table if not exists products(
    ->      id int unsigned primary key auto_increment,
    ->      product_name varchar(100),
    ->      brand_id int,
    ->      category_id int,
    ->      price float,
    ->      is_active tinyint default 0
    ->      );
Query OK, 0 rows affected (0.161 sec)

MariaDB [h_tasks]> show tables;
+-------------------+
| Tables_in_h_tasks |
+-------------------+
| brands            |
| categories        |
| products          |
+-------------------+
3 rows in set (0.001 sec)

MariaDB [h_tasks]> insert into brands(name) values('Apple'),('Samsung'),('Sony');
Query OK, 3 rows affected (0.058 sec)
Records: 3  Duplicates: 0  Warnings: 0

MariaDB [h_tasks]> select * from brands;
+----+---------+
| id | name    |
+----+---------+
|  1 | Apple   |
|  2 | Samsung |
|  3 | Sony    |
+----+---------+
3 rows in set (0.001 sec)

MariaDB [h_tasks]> insert into categories(name) values('Smartphones'),('Laptops'),('Accessories');
Query OK, 3 rows affected (0.046 sec)
Records: 3  Duplicates: 0  Warnings: 0

MariaDB [h_tasks]> select * from categories;
+----+-------------+
| id | name        |
+----+-------------+
|  1 | Smartphones |
|  2 | Laptops     |
|  3 | Accessories |
+----+-------------+
3 rows in set (0.001 sec)

MariaDB [h_tasks]> insert into products(product_name, brand_id, category_id, price, is_active) values
    -> ('iPhone 13', 1, 1, 999.99, 1),
    -> ('Galaxy S21', 2, 1, 799.99, 1),
    -> ('Xperia 5', 3, 1, 899.99, 0),
    -> ('MacBook Pro', 1, 2, 1999.99, 1),
    -> ('Galaxy Book', 2, 2, 1499.99, 0),
    -> ('VAIO Z', 3, 2, 1799.99, 1),
    -> ('AirPods Pro', 1, 3, 249.99, 1),
    -> ('Galaxy Buds Pro', 2, 3, 199.99, 0),
    -> ('WF-1000XM4', 3, 3, 279.99, 1);
Query OK, 9 rows affected (0.044 sec)
Records: 9  Duplicates: 0  Warnings: 0

MariaDB [h_tasks]> select * from products;
+----+-----------------+----------+-------------+---------+-----------+
| id | product_name    | brand_id | category_id | price   | is_active |
+----+-----------------+----------+-------------+---------+-----------+
|  1 | iPhone 13       |        1 |           1 |  999.99 |         1 |
|  2 | Galaxy S21      |        2 |           1 |  799.99 |         1 |
|  3 | Xperia 5        |        3 |           1 |  899.99 |         0 |
|  4 | MacBook Pro     |        1 |           2 | 1999.99 |         1 |
|  5 | Galaxy Book     |        2 |           2 | 1499.99 |         0 |
|  6 | VAIO Z          |        3 |           2 | 1799.99 |         1 |
|  7 | AirPods Pro     |        1 |           3 |  249.99 |         1 |
|  8 | Galaxy Buds Pro |        2 |           3 |  199.99 |         0 |
|  9 | WF-1000XM4      |        3 |           3 |  279.99 |         1 |
+----+-----------------+----------+-------------+---------+-----------+
9 rows in set (0.001 sec)

MariaDB [h_tasks]> drop view if exists vw_active_products;
Query OK, 0 rows affected, 1 warning (0.001 sec)

MariaDB [h_tasks]> create view vw_active_products as
    -> select p.id, p.product_name, b.name, c.name, p.price
    -> from products p, brands b, categories c
    -> where p.brand_id = b.id and p.category_id = c.id and p.is_active = 1;
ERROR 1060 (42S21): Duplicate column name 'name'
MariaDB [h_tasks]> drop view if exists vw_active_products;
Query OK, 0 rows affected, 1 warning (0.000 sec)

MariaDB [h_tasks]> create view vw_active_products as
    -> select p.id, p.product_name, b.name as brand, c.name as category, p.price
    -> from products p, brands b, categories c
    -> where p.brand_id = b.id and p.category_id = c.id and p.is_active = 1;
Query OK, 0 rows affected (0.033 sec)

MariaDB [h_tasks]> select * from vw_active_products;
+----+--------------+---------+-------------+---------+
| id | product_name | brand   | category    | price   |
+----+--------------+---------+-------------+---------+
|  1 | iPhone 13    | Apple   | Smartphones |  999.99 |
|  2 | Galaxy S21   | Samsung | Smartphones |  799.99 |
|  4 | MacBook Pro  | Apple   | Laptops     | 1999.99 |
|  6 | VAIO Z       | Sony    | Laptops     | 1799.99 |
|  7 | AirPods Pro  | Apple   | Accessories |  249.99 |
|  9 | WF-1000XM4   | Sony    | Accessories |  279.99 |
+----+--------------+---------+-------------+---------+
6 rows in set (0.028 sec)

MariaDB [h_tasks]> select * from vw_active_products where price > 1000;
+----+--------------+-------+----------+---------+
| id | product_name | brand | category | price   |
+----+--------------+-------+----------+---------+
|  4 | MacBook Pro  | Apple | Laptops  | 1999.99 |
|  6 | VAIO Z       | Sony  | Laptops  | 1799.99 |
+----+--------------+-------+----------+---------+
2 rows in set (0.001 sec)

MariaDB [h_tasks]> select * from vw_active_products where category = 'Smartphones' and brand = 'Apple';
+----+--------------+-------+-------------+--------+
| id | product_name | brand | category    | price  |
+----+--------------+-------+-------------+--------+
|  1 | iPhone 13    | Apple | Smartphones | 999.99 |
+----+--------------+-------+-------------+--------+
1 row in set (0.001 sec)

MariaDB [h_tasks]> select * from vw_active_products where category = 'Smartphones' and price >700 and price < 1000;
+----+--------------+---------+-------------+--------+
| id | product_name | brand   | category    | price  |
+----+--------------+---------+-------------+--------+
|  1 | iPhone 13    | Apple   | Smartphones | 999.99 |
|  2 | Galaxy S21   | Samsung | Smartphones | 799.99 |
+----+--------------+---------+-------------+--------+
2 rows in set (0.001 sec)

MariaDB [h_tasks]> select * from vw_active_products where category = 'Accessories' and price >= 200 and price <= 1000;
+----+--------------+-------+-------------+--------+
| id | product_name | brand | category    | price  |
+----+--------------+-------+-------------+--------+
|  7 | AirPods Pro  | Apple | Accessories | 249.99 |
|  9 | WF-1000XM4   | Sony  | Accessories | 279.99 |
+----+--------------+-------+-------------+--------+
2 rows in set (0.002 sec)

MariaDB [h_tasks]> show databases;
+--------------------+
| Database           |
+--------------------+
| ahms_db            |
| h_tasks            |
| home_tasks         |
| information_schema |
| mydata             |
| mysql              |
| performance_schema |
| phpmyadmin         |
| test               |
+--------------------+
9 rows in set (0.002 sec)

MariaDB [h_tasks]> use ahms_db;
Database changed
MariaDB [ahms_db]> select * from students;
+----+-----------+------------------+----------+-------------+
| id | full_name | email            | address  | is_inactive |
+----+-----------+------------------+----------+-------------+
|  1 | Mina      | asjg@kj.hb       | Lalbag   |           0 |
|  2 | Mithu     | truysjg@kj.hb    | Rangpur  |           0 |
|  5 | Raju      | lkjsdajg@kj.hb   | Shahbag  |           1 |
|  6 | Munna     | raju@xmple.com   | Rajshahi |           1 |
|  7 | Eimrul    | eimrul@mail.info | NULL     |           0 |
|  8 | Tasnim    | tasnim@mail.info | NULL     |           0 |
+----+-----------+------------------+----------+-------------+
6 rows in set (0.024 sec)

MariaDB [ahms_db]> select * from results;
+----+------------+-------+-----------+
| id | student_id | score | exam_type |
+----+------------+-------+-----------+
|  1 |          1 |    50 | Final26   |
|  2 |          2 |    20 | Monthly   |
|  3 |          5 |    39 | Monthly   |
|  4 |          7 |    59 | Monthly   |
|  5 |          8 |    93 | Monthly   |
|  6 |          1 |    90 | Final     |
|  7 |          5 |    70 | Final     |
|  8 |          8 |    79 | Final     |
|  9 |          2 |    20 | Mid-1     |
| 10 |          5 |    39 | Mid-1     |
| 11 |          7 |    28 | Mid-1     |
| 12 |          8 |    93 | Mid-1     |
| 13 |          1 |    33 | Mid-1     |
| 14 |          2 |    20 | Mid-2     |
| 15 |          5 |    39 | Mid-2     |
| 16 |          7 |    59 | Mid-2     |
| 17 |          7 |    65 | Final     |
+----+------------+-------+-----------+
17 rows in set (0.019 sec)

MariaDB [ahms_db]> create table  if not exists student_logs (
    ->     id int unsigned auto_increment primary key,
    ->     student_id int ,
    ->     status varchar(20)
    -> );
Query OK, 0 rows affected (0.133 sec)

MariaDB [ahms_db]> select * from results;
+----+------------+-------+-----------+
| id | student_id | score | exam_type |
+----+------------+-------+-----------+
|  1 |          1 |    50 | Final26   |
|  2 |          2 |    20 | Monthly   |
|  3 |          5 |    39 | Monthly   |
|  4 |          7 |    59 | Monthly   |
|  5 |          8 |    93 | Monthly   |
|  6 |          1 |    90 | Final     |
|  7 |          5 |    70 | Final     |
|  8 |          8 |    79 | Final     |
|  9 |          2 |    20 | Mid-1     |
| 10 |          5 |    39 | Mid-1     |
| 11 |          7 |    28 | Mid-1     |
| 12 |          8 |    93 | Mid-1     |
| 13 |          1 |    33 | Mid-1     |
| 14 |          2 |    20 | Mid-2     |
| 15 |          5 |    39 | Mid-2     |
| 16 |          7 |    59 | Mid-2     |
| 17 |          7 |    65 | Final     |
+----+------------+-------+-----------+
17 rows in set (0.001 sec)

MariaDB [ahms_db]> select * from student_logs;
Empty set (0.002 sec)

MariaDB [ahms_db]> desc student_logs;
+------------+------------------+------+-----+---------+----------------+
| Field      | Type             | Null | Key | Default | Extra          |
+------------+------------------+------+-----+---------+----------------+
| id         | int(10) unsigned | NO   | PRI | NULL    | auto_increment |
| student_id | int(11)          | YES  |     | NULL    |                |
| status     | varchar(20)      | YES  |     | NULL    |                |
+------------+------------------+------+-----+---------+----------------+
3 rows in set (0.031 sec)

MariaDB [ahms_db]> drop table if exists student_logs;
Query OK, 0 rows affected (0.141 sec)

MariaDB [ahms_db]> create table  if not exists student_logs (
    ->     id int unsigned auto_increment primary key,
    ->     student_id int ,
    ->     status varchar(20),
    ->     time timestamp
    -> );
Query OK, 0 rows affected (0.522 sec)

MariaDB [ahms_db]> desc student_logs;
+------------+------------------+------+-----+---------------------+-------------------------------+
| Field      | Type             | Null | Key | Default             | Extra                         |
+------------+------------------+------+-----+---------------------+-------------------------------+
| id         | int(10) unsigned | NO   | PRI | NULL                | auto_increment                |
| student_id | int(11)          | YES  |     | NULL                |                               |
| status     | varchar(20)      | YES  |     | NULL                |                               |
| time       | timestamp        | NO   |     | current_timestamp() | on update current_timestamp() |
+------------+------------------+------+-----+---------------------+-------------------------------+
4 rows in set (0.024 sec)

MariaDB [ahms_db]> create trigger add_student
    -> insert after on students
    -> for each row
    -> insert into student_logs(student_id, status, time)
    -> values(new.id, "Added", now());
ERROR 1064 (42000): You have an error in your SQL syntax; check the manual that corresponds to your MariaDB server version for the right syntax to use near 'insert after on students
for each row
insert into student_logs(student_id, st...' at line 2
MariaDB [ahms_db]> show triggers;
Empty set (0.024 sec)

MariaDB [ahms_db]> create trigger add_student
    -> after insert on students
    -> for each row
    -> insert into student_logs(student_id, status, time)
    -> values(new.id, "Added", now());
Query OK, 0 rows affected (0.031 sec)

MariaDB [ahms_db]> show triggers;
+-------------+--------+----------+------------------------------------------------------------------------------------+--------+------------------------+-----------------------------------------------------+----------------+----------------------+----------------------+--------------------+
| Trigger     | Event  | Table    | Statement                                                                          | Timing | Created                | sql_mode                                            | Definer        | character_set_client | collation_connection | Database Collation |
+-------------+--------+----------+------------------------------------------------------------------------------------+--------+------------------------+-----------------------------------------------------+----------------+----------------------+----------------------+--------------------+
| add_student | INSERT | students | insert into student_logs(student_id, status, time)
values(new.id, "Added", now()) | AFTER  | 2026-05-19 12:10:16.43 | NO_ZERO_IN_DATE,NO_ZERO_DATE,NO_ENGINE_SUBSTITUTION | root@localhost | cp850                | cp850_general_ci     | utf8mb4_general_ci |
+-------------+--------+----------+------------------------------------------------------------------------------------+--------+------------------------+-----------------------------------------------------+----------------+----------------------+----------------------+--------------------+
1 row in set (0.021 sec)

MariaDB [ahms_db]> show triggers;insert into students(full_name, email, is_inactive)
+-------------+--------+----------+------------------------------------------------------------------------------------+--------+------------------------+-----------------------------------------------------+----------------+----------------------+----------------------+--------------------+
| Trigger     | Event  | Table    | Statement                                                                          | Timing | Created                | sql_mode                                            | Definer        | character_set_client | collation_connection | Database Collation |
+-------------+--------+----------+------------------------------------------------------------------------------------+--------+------------------------+-----------------------------------------------------+----------------+----------------------+----------------------+--------------------+
| add_student | INSERT | students | insert into student_logs(student_id, status, time)
values(new.id, "Added", now()) | AFTER  | 2026-05-19 12:10:16.43 | NO_ZERO_IN_DATE,NO_ZERO_DATE,NO_ENGINE_SUBSTITUTION | root@localhost | cp850                | cp850_general_ci     | utf8mb4_general_ci |
+-------------+--------+----------+------------------------------------------------------------------------------------+--------+------------------------+-----------------------------------------------------+----------------+----------------------+----------------------+--------------------+
1 row in set (0.023 sec)

    -> values("Noushin", "noushin@mail.info", 0);
Query OK, 1 row affected (0.124 sec)

MariaDB [ahms_db]> select * from students;
+----+-----------+-------------------+----------+-------------+
| id | full_name | email             | address  | is_inactive |
+----+-----------+-------------------+----------+-------------+
|  1 | Mina      | asjg@kj.hb        | Lalbag   |           0 |
|  2 | Mithu     | truysjg@kj.hb     | Rangpur  |           0 |
|  5 | Raju      | lkjsdajg@kj.hb    | Shahbag  |           1 |
|  6 | Munna     | raju@xmple.com    | Rajshahi |           1 |
|  7 | Eimrul    | eimrul@mail.info  | NULL     |           0 |
|  8 | Tasnim    | tasnim@mail.info  | NULL     |           0 |
|  9 | Noushin   | noushin@mail.info | NULL     |           0 |
+----+-----------+-------------------+----------+-------------+
7 rows in set (0.001 sec)

MariaDB [ahms_db]> create trigger update_student
    -> after update on students
    -> for each row
    -> insert into student_logs(student_id, status, time)
    -> values(old.id, "Updated", now());
Query OK, 0 rows affected (0.050 sec)

MariaDB [ahms_db]> show triggers;
+----------------+--------+----------+--------------------------------------------------------------------------------------+--------+------------------------+-----------------------------------------------------+----------------+----------------------+----------------------+--------------------+
| Trigger        | Event  | Table    | Statement                                                                            | Timing | Created                | sql_mode                                            | Definer        | character_set_client | collation_connection | Database Collation |
+----------------+--------+----------+--------------------------------------------------------------------------------------+--------+------------------------+-----------------------------------------------------+----------------+----------------------+----------------------+--------------------+
| add_student    | INSERT | students | insert into student_logs(student_id, status, time)
values(new.id, "Added", now())   | AFTER  | 2026-05-19 12:10:16.43 | NO_ZERO_IN_DATE,NO_ZERO_DATE,NO_ENGINE_SUBSTITUTION | root@localhost | cp850                | cp850_general_ci     | utf8mb4_general_ci |
| update_student | UPDATE | students | insert into student_logs(student_id, status, time)
values(old.id, "Updated", now()) | AFTER  | 2026-05-19 12:25:58.03 | NO_ZERO_IN_DATE,NO_ZERO_DATE,NO_ENGINE_SUBSTITUTION | root@localhost | cp850                | cp850_general_ci     | utf8mb4_general_ci |
+----------------+--------+----------+--------------------------------------------------------------------------------------+--------+------------------------+-----------------------------------------------------+----------------+----------------------+----------------------+--------------------+
2 rows in set (0.027 sec)

MariaDB [ahms_db]> update students set email = "mian@mail.info", address = "Cartoon" where id = 1;
Query OK, 1 row affected (0.084 sec)
Rows matched: 1  Changed: 1  Warnings: 0

MariaDB [ahms_db]> select * from students;
+----+-----------+-------------------+----------+-------------+
| id | full_name | email             | address  | is_inactive |
+----+-----------+-------------------+----------+-------------+
|  1 | Mina      | mian@mail.info    | Cartoon  |           0 |
|  2 | Mithu     | truysjg@kj.hb     | Rangpur  |           0 |
|  5 | Raju      | lkjsdajg@kj.hb    | Shahbag  |           1 |
|  6 | Munna     | raju@xmple.com    | Rajshahi |           1 |
|  7 | Eimrul    | eimrul@mail.info  | NULL     |           0 |
|  8 | Tasnim    | tasnim@mail.info  | NULL     |           0 |
|  9 | Noushin   | noushin@mail.info | NULL     |           0 |
+----+-----------+-------------------+----------+-------------+
7 rows in set (0.001 sec)

MariaDB [ahms_db]> select * from student_logs;
+----+------------+---------+---------------------+
| id | student_id | status  | time                |
+----+------------+---------+---------------------+
|  1 |          9 | Added   | 2026-05-19 12:21:18 |
|  2 |          1 | Updated | 2026-05-19 12:29:35 |
+----+------------+---------+---------------------+
2 rows in set (0.001 sec)

MariaDB [ahms_db]> update students set email = "raju@mail.info", address = "Dhaka" where id = 5;
Query OK, 1 row affected (0.055 sec)
Rows matched: 1  Changed: 1  Warnings: 0

MariaDB [ahms_db]> select * from students;
+----+-----------+-------------------+----------+-------------+
| id | full_name | email             | address  | is_inactive |
+----+-----------+-------------------+----------+-------------+
|  1 | Mina      | mian@mail.info    | Cartoon  |           0 |
|  2 | Mithu     | truysjg@kj.hb     | Rangpur  |           0 |
|  5 | Raju      | raju@mail.info    | Dhaka    |           1 |
|  6 | Munna     | raju@xmple.com    | Rajshahi |           1 |
|  7 | Eimrul    | eimrul@mail.info  | NULL     |           0 |
|  8 | Tasnim    | tasnim@mail.info  | NULL     |           0 |
|  9 | Noushin   | noushin@mail.info | NULL     |           0 |
+----+-----------+-------------------+----------+-------------+
7 rows in set (0.001 sec)

MariaDB [ahms_db]>
MariaDB [ahms_db]> insert into students(full_name, email, is_inactive)
    -> values("Nahid", "nahid@mail.info", 0);
Query OK, 1 row affected (0.049 sec)

MariaDB [ahms_db]> select * from students;
+----+-----------+-------------------+----------+-------------+
| id | full_name | email             | address  | is_inactive |
+----+-----------+-------------------+----------+-------------+
|  1 | Mina      | mian@mail.info    | Cartoon  |           0 |
|  2 | Mithu     | truysjg@kj.hb     | Rangpur  |           0 |
|  5 | Raju      | raju@mail.info    | Dhaka    |           1 |
|  6 | Munna     | raju@xmple.com    | Rajshahi |           1 |
|  7 | Eimrul    | eimrul@mail.info  | NULL     |           0 |
|  8 | Tasnim    | tasnim@mail.info  | NULL     |           0 |
|  9 | Noushin   | noushin@mail.info | NULL     |           0 |
| 10 | Nahid     | nahid@mail.info   | NULL     |           0 |
+----+-----------+-------------------+----------+-------------+
8 rows in set (0.001 sec)

MariaDB [ahms_db]>
MariaDB [ahms_db]> insert into students(full_name, email, is_inactive)
    -> values("N/A", "abc@mail.info", 1);
Query OK, 1 row affected (0.040 sec)

MariaDB [ahms_db]> select * from student_logs;
+----+------------+---------+---------------------+
| id | student_id | status  | time                |
+----+------------+---------+---------------------+
|  1 |          9 | Added   | 2026-05-19 12:21:18 |
|  2 |          1 | Updated | 2026-05-19 12:29:35 |
|  3 |          5 | Updated | 2026-05-19 12:38:24 |
|  4 |         10 | Added   | 2026-05-19 12:39:59 |
|  5 |         11 | Added   | 2026-05-19 12:41:12 |
+----+------------+---------+---------------------+
5 rows in set (0.001 sec)

MariaDB [ahms_db]> delete from students where id = 10;
Query OK, 1 row affected (0.052 sec)

MariaDB [ahms_db]> select * from students;
+----+-----------+-------------------+----------+-------------+
| id | full_name | email             | address  | is_inactive |
+----+-----------+-------------------+----------+-------------+
|  1 | Mina      | mian@mail.info    | Cartoon  |           0 |
|  2 | Mithu     | truysjg@kj.hb     | Rangpur  |           0 |
|  5 | Raju      | raju@mail.info    | Dhaka    |           1 |
|  6 | Munna     | raju@xmple.com    | Rajshahi |           1 |
|  7 | Eimrul    | eimrul@mail.info  | NULL     |           0 |
|  8 | Tasnim    | tasnim@mail.info  | NULL     |           0 |
|  9 | Noushin   | noushin@mail.info | NULL     |           0 |
| 11 | N/A       | abc@mail.info     | NULL     |           1 |
+----+-----------+-------------------+----------+-------------+
8 rows in set (0.001 sec)

MariaDB [ahms_db]> delete from students where id = 11;
Query OK, 1 row affected (0.059 sec)

MariaDB [ahms_db]> select * from students;
+----+-----------+-------------------+----------+-------------+
| id | full_name | email             | address  | is_inactive |
+----+-----------+-------------------+----------+-------------+
|  1 | Mina      | mian@mail.info    | Cartoon  |           0 |
|  2 | Mithu     | truysjg@kj.hb     | Rangpur  |           0 |
|  5 | Raju      | raju@mail.info    | Dhaka    |           1 |
|  6 | Munna     | raju@xmple.com    | Rajshahi |           1 |
|  7 | Eimrul    | eimrul@mail.info  | NULL     |           0 |
|  8 | Tasnim    | tasnim@mail.info  | NULL     |           0 |
|  9 | Noushin   | noushin@mail.info | NULL     |           0 |
+----+-----------+-------------------+----------+-------------+
7 rows in set (0.001 sec)

MariaDB [ahms_db]> select * from student_logs;
+----+------------+---------+---------------------+
| id | student_id | status  | time                |
+----+------------+---------+---------------------+
|  1 |          9 | Added   | 2026-05-19 12:21:18 |
|  2 |          1 | Updated | 2026-05-19 12:29:35 |
|  3 |          5 | Updated | 2026-05-19 12:38:24 |
|  4 |         10 | Added   | 2026-05-19 12:39:59 |
|  5 |         11 | Added   | 2026-05-19 12:41:12 |
+----+------------+---------+---------------------+
5 rows in set (0.001 sec)

MariaDB [ahms_db]> select * from student_logs;
+----+------------+---------+---------------------+
| id | student_id | status  | time                |
+----+------------+---------+---------------------+
|  1 |          9 | Added   | 2026-05-19 12:21:18 |
|  2 |          1 | Updated | 2026-05-19 12:29:35 |
|  3 |          5 | Updated | 2026-05-19 12:38:24 |
|  4 |         10 | Added   | 2026-05-19 12:39:59 |
|  5 |         11 | Added   | 2026-05-19 12:41:12 |
+----+------------+---------+---------------------+
5 rows in set (0.001 sec)

MariaDB [ahms_db]> create trigger if not exists delete_student
    -> after delete on students
    -> for each row
    -> insert into student_logs(student_id, status, time)
    -> values(old.id, "Deleted", now());
Query OK, 0 rows affected (0.061 sec)

MariaDB [ahms_db]> show triggers;
+----------------+--------+----------+--------------------------------------------------------------------------------------+--------+------------------------+-----------------------------------------------------+----------------+----------------------+----------------------+--------------------+
| Trigger        | Event  | Table    | Statement                                                                            | Timing | Created                | sql_mode                                            | Definer        | character_set_client | collation_connection | Database Collation |
+----------------+--------+----------+--------------------------------------------------------------------------------------+--------+------------------------+-----------------------------------------------------+----------------+----------------------+----------------------+--------------------+
| add_student    | INSERT | students | insert into student_logs(student_id, status, time)
values(new.id, "Added", now())   | AFTER  | 2026-05-19 12:10:16.43 | NO_ZERO_IN_DATE,NO_ZERO_DATE,NO_ENGINE_SUBSTITUTION | root@localhost | cp850                | cp850_general_ci     | utf8mb4_general_ci |
| update_student | UPDATE | students | insert into student_logs(student_id, status, time)
values(old.id, "Updated", now()) | AFTER  | 2026-05-19 12:25:58.03 | NO_ZERO_IN_DATE,NO_ZERO_DATE,NO_ENGINE_SUBSTITUTION | root@localhost | cp850                | cp850_general_ci     | utf8mb4_general_ci |
| delete_student | DELETE | students | insert into student_logs(student_id, status, time)
values(old.id, "Deleted", now())  | AFTER  | 2026-05-19 12:43:44.22 | NO_ZERO_IN_DATE,NO_ZERO_DATE,NO_ENGINE_SUBSTITUTION | root@localhost | cp850                | cp850_general_ci     | utf8mb4_general_ci |
+----------------+--------+----------+--------------------------------------------------------------------------------------+--------+------------------------+-----------------------------------------------------+----------------+----------------------+----------------------+--------------------+
3 rows in set (0.022 sec)

MariaDB [ahms_db]> select * from student_logs;
+----+------------+---------+---------------------+
| id | student_id | status  | time                |
+----+------------+---------+---------------------+
|  1 |          9 | Added   | 2026-05-19 12:21:18 |
|  2 |          1 | Updated | 2026-05-19 12:29:35 |
|  3 |          5 | Updated | 2026-05-19 12:38:24 |
|  4 |         10 | Added   | 2026-05-19 12:39:59 |
|  5 |         11 | Added   | 2026-05-19 12:41:12 |
+----+------------+---------+---------------------+
5 rows in set (0.001 sec)

MariaDB [ahms_db]> insert into students(full_name, email, is_inactive)
    -> values("Nahid", "nahid@mail.info", 0);
Query OK, 1 row affected (0.064 sec)

MariaDB [ahms_db]>
MariaDB [ahms_db]>
MariaDB [ahms_db]> insert into students(full_name, email, is_inactive)
    -> values("N/A", "abc@mail.info", 1);
Query OK, 1 row affected (0.029 sec)

MariaDB [ahms_db]> select * from students;
+----+-----------+-------------------+----------+-------------+
| id | full_name | email             | address  | is_inactive |
+----+-----------+-------------------+----------+-------------+
|  1 | Mina      | mian@mail.info    | Cartoon  |           0 |
|  2 | Mithu     | truysjg@kj.hb     | Rangpur  |           0 |
|  5 | Raju      | raju@mail.info    | Dhaka    |           1 |
|  6 | Munna     | raju@xmple.com    | Rajshahi |           1 |
|  7 | Eimrul    | eimrul@mail.info  | NULL     |           0 |
|  8 | Tasnim    | tasnim@mail.info  | NULL     |           0 |
|  9 | Noushin   | noushin@mail.info | NULL     |           0 |
| 12 | Nahid     | nahid@mail.info   | NULL     |           0 |
| 13 | N/A       | abc@mail.info     | NULL     |           1 |
+----+-----------+-------------------+----------+-------------+
9 rows in set (0.001 sec)

MariaDB [ahms_db]> delete from students where id = 13;
Query OK, 1 row affected (0.054 sec)

MariaDB [ahms_db]> delete from students where id = 12;
Query OK, 1 row affected (0.056 sec)

MariaDB [ahms_db]> select * from student_logs;
+----+------------+---------+---------------------+
| id | student_id | status  | time                |
+----+------------+---------+---------------------+
|  1 |          9 | Added   | 2026-05-19 12:21:18 |
|  2 |          1 | Updated | 2026-05-19 12:29:35 |
|  3 |          5 | Updated | 2026-05-19 12:38:24 |
|  4 |         10 | Added   | 2026-05-19 12:39:59 |
|  5 |         11 | Added   | 2026-05-19 12:41:12 |
|  6 |         12 | Added   | 2026-05-19 12:44:30 |
|  7 |         13 | Added   | 2026-05-19 12:44:32 |
|  8 |         13 | Deleted | 2026-05-19 12:45:05 |
|  9 |         12 | Deleted | 2026-05-19 12:45:15 |
+----+------------+---------+---------------------+
9 rows in set (0.001 sec)


